{
  "$schema": "https://json-schema.org/draft/2020-12/schema",
  "$id": "https://w3id.org/soranoha/schemas/parser-rq-source-recognition-work.schema.json",
  "title": "Parser release qualification source-recognition work record",
  "type": "object",
  "required": [
    "schema_version",
    "instrument_version",
    "coordinate_system",
    "status"
  ],
  "additionalProperties": false,
  "properties": {
    "schema_version": {
      "const": "abc/parser-rq-source-recognition-work/v3"
    },
    "qualification_identity_ref": {
      "$ref": "#/$defs/hash"
    },
    "capture_generation_ref": {
      "$ref": "#/$defs/hash"
    },
    "policy_hash": {
      "$ref": "#/$defs/hash"
    },
    "instrument_version": {
      "type": "string",
      "minLength": 1
    },
    "work_id": {
      "type": "string",
      "minLength": 1
    },
    "coordinate_system": {
      "const": "decoded_utf8"
    },
    "ledger": {
      "$ref": "#/$defs/blob"
    },
    "regions": {
      "$ref": "#/$defs/regions"
    },
    "status": {
      "enum": [
        "ok",
        "unavailable"
      ]
    },
    "eligible_bytes": {
      "type": "integer",
      "minimum": 0,
      "maximum": 9007199254740991
    },
    "recognized_bytes": {
      "type": "integer",
      "minimum": 0,
      "maximum": 9007199254740991
    },
    "accounted_bytes": {
      "type": "integer",
      "minimum": 0,
      "maximum": 9007199254740991
    },
    "semantic_gap_bytes": {
      "type": "integer",
      "minimum": 0,
      "maximum": 9007199254740991
    },
    "unaccounted_bytes": {
      "type": "integer",
      "minimum": 0,
      "maximum": 9007199254740991
    },
    "recognized": {
      "$ref": "#/$defs/intervals"
    },
    "accounted": {
      "$ref": "#/$defs/intervals"
    },
    "semantic_gaps": {
      "$ref": "#/$defs/intervals"
    },
    "unaccounted": {
      "$ref": "#/$defs/intervals"
    },
    "metadata": {
      "$ref": "#/$defs/metadata"
    },
    "errors": {
      "type": "array",
      "minItems": 1,
      "items": {
        "type": "string",
        "minLength": 1
      }
    }
  },
  "oneOf": [
    {
      "properties": {
        "status": {
          "const": "ok"
        }
      },
      "required": [
        "qualification_identity_ref",
        "capture_generation_ref",
        "policy_hash",
        "work_id",
        "ledger",
        "eligible_bytes",
        "recognized_bytes",
        "accounted_bytes",
        "semantic_gap_bytes",
        "unaccounted_bytes",
        "recognized",
        "accounted",
        "semantic_gaps",
        "unaccounted"
      ],
      "not": {
        "required": [
          "errors"
        ]
      }
    },
    {
      "properties": {
        "status": {
          "const": "unavailable"
        }
      },
      "required": [
        "errors"
      ],
      "not": {
        "anyOf": [
          {
            "required": [
              "eligible_bytes"
            ]
          },
          {
            "required": [
              "recognized_bytes"
            ]
          },
          {
            "required": [
              "accounted_bytes"
            ]
          },
          {
            "required": [
              "semantic_gap_bytes"
            ]
          },
          {
            "required": [
              "unaccounted_bytes"
            ]
          },
          {
            "required": [
              "recognized"
            ]
          },
          {
            "required": [
              "accounted"
            ]
          },
          {
            "required": [
              "semantic_gaps"
            ]
          },
          {
            "required": [
              "unaccounted"
            ]
          }
        ]
      }
    }
  ],
  "$defs": {
    "hash": {
      "type": "string",
      "pattern": "^sha256:[0-9a-f]{64}$"
    },
    "interval": {
      "type": "object",
      "required": [
        "start",
        "end"
      ],
      "additionalProperties": false,
      "properties": {
        "start": {
          "type": "integer",
          "minimum": 0,
          "maximum": 9007199254740991
        },
        "end": {
          "type": "integer",
          "minimum": 1,
          "maximum": 9007199254740991
        }
      }
    },
    "intervals": {
      "type": "array",
      "items": {
        "$ref": "#/$defs/interval"
      }
    },
    "blob": {
      "type": "object",
      "required": [
        "sha256",
        "bytes",
        "media_type",
        "locator"
      ],
      "additionalProperties": false,
      "properties": {
        "sha256": {
          "$ref": "#/$defs/hash"
        },
        "bytes": {
          "type": "integer",
          "minimum": 0,
          "maximum": 9007199254740991
        },
        "media_type": {
          "const": "application/json"
        },
        "locator": {
          "type": "string",
          "minLength": 1
        }
      }
    },
    "regions": {
      "description": "The three declared source regions in decoded_utf8 coordinates: header [0, body_start), body [body_start, body_end), tail [body_end, len). Derived from aozora_body_range alone and mapped back through the sanitize map. The tail is anchored on the body end, not on that function's tail start, so the blank lines between them belong to the tail rather than to no region. See docs/adr/parser-rq-source-region-partition.md.",
      "type": "object",
      "required": [
        "header",
        "body",
        "tail"
      ],
      "additionalProperties": false,
      "properties": {
        "header": {
          "$ref": "#/$defs/region_interval"
        },
        "body": {
          "$ref": "#/$defs/region_interval"
        },
        "tail": {
          "$ref": "#/$defs/region_interval"
        }
      }
    },
    "region_interval": {
      "description": "A declared region. Unlike a measurement interval this may be empty: a work with no editorial header has an empty header region and one with no colophon has an empty tail, and both are legitimate rather than defective. Endpoints share the safe-integer maximum every other offset in this protocol carries, so a region cannot describe a file no consumer could address; start <= end is NOT expressible here and is enforced by the validators, which check the whole ordered chain across all three regions rather than each region alone.",
      "type": "object",
      "required": [
        "start",
        "end"
      ],
      "additionalProperties": false,
      "properties": {
        "start": {
          "type": "integer",
          "minimum": 0,
          "maximum": 9007199254740991
        },
        "end": {
          "type": "integer",
          "minimum": 0,
          "maximum": 9007199254740991
        }
      }
    },
    "metadata": {
      "description": "The metadata population: header and tail folded together. They are distinct regions so a failure localizes to one end of the file, but they qualify under one conjunctive predicate, so their totals are folded here. The measure is ATTRIBUTION and not byte accounting: a byte counts only when covered by a fact whose source_role the classified-source policy lists in metadata_attributing_roles, and a preserved_opaque fact never counts because that disposition is the statement that nothing is claimed about the bytes. A byte may therefore be accounted for by some fact and still be unattributed. TWO DENOMINATORS ARE PUBLISHED AND THE RATIO IS OVER content_bytes, NOT eligible_bytes. eligible_bytes is the header and tail regions whole, kept because it is what makes the region partition assertable: eligible_bytes + metadata.eligible_bytes == the decoded file, disjoint. content_bytes is the same regions with line terminators and wholly blank lines removed, and it is the attribution denominator. A line terminator is not packaging that can be understood or misunderstood but the delimiter between packaging items, present in identical quantity however much the instrument recognizes; counting it made the measure unreachable at 1.0 by construction and made a CRLF work score strictly below a byte-identical LF work whose packaging is understood exactly as well. A wholly blank line is excluded on the same footing, and a line of nothing but layout whitespace is excluded with it, because otherwise the measure would move according to whether a transcriber left trailing spaces.",
      "type": "object",
      "required": [
        "eligible_bytes",
        "content_bytes",
        "attributed_bytes",
        "unattributed_bytes",
        "unattributed_content_bytes",
        "attributed",
        "unattributed",
        "unattributed_content"
      ],
      "additionalProperties": false,
      "properties": {
        "eligible_bytes": {
          "type": "integer",
          "minimum": 0,
          "maximum": 9007199254740991
        },
        "content_bytes": {
          "description": "The attribution denominator. Never greater than eligible_bytes and never less than attributed_bytes; the instrument refuses to emit a record where either fails.",
          "type": "integer",
          "minimum": 0,
          "maximum": 9007199254740991
        },
        "attributed_bytes": {
          "type": "integer",
          "minimum": 0,
          "maximum": 9007199254740991
        },
        "unattributed_bytes": {
          "description": "Region bytes carrying no attributing fact, terminators and blank lines included. Kept as the region-denominator complement.",
          "type": "integer",
          "minimum": 0,
          "maximum": 9007199254740991
        },
        "unattributed_content_bytes": {
          "description": "Content bytes carrying no attributing fact: the complement that the ratio is over, and the one that says what packaging was not understood. attributed_bytes + unattributed_content_bytes == content_bytes.",
          "type": "integer",
          "minimum": 0,
          "maximum": 9007199254740991
        },
        "attributed": {
          "$ref": "#/$defs/intervals"
        },
        "unattributed": {
          "$ref": "#/$defs/intervals"
        },
        "unattributed_content": {
          "description": "Where the unattributed content is. This is the interval set a reader wants when asking what packaging the instrument failed to place; unattributed above is dominated by line terminators.",
          "$ref": "#/$defs/intervals"
        }
      }
    }
  },
  "description": "v2. eligible_bytes is the BODY region, not the whole decoded file: the ledger's facts come from lexing the body projection, so a whole-file denominator divided across a coordinate boundary. The header and tail are measured separately under `metadata`, so no byte leaves the accounting. Published v1 records are validated by parser-rq-source-recognition-work-v1.schema.json. See docs/adr/parser-rq-source-region-partition.md."
}
