{"accounted":[{"end":22,"start":0}],"accounted_bytes":22,"capture_generation_ref":"sha256:4245791446c90cafec39c28aa0eed9a1861c76c6053e2d3cc2f097489c104ecb","coordinate_system":"decoded_utf8","eligible_bytes":22,"instrument_version":"parser-rq-source-recognition-v4","ledger":{"bytes":2091,"locator":"sha256/ca/cac33a6496336968727d782d6ff9b3e0efddbd19ade5dd55625949011c2f248b.json","media_type":"application/json","sha256":"sha256:cac33a6496336968727d782d6ff9b3e0efddbd19ade5dd55625949011c2f248b"},"metadata":{"attributed":[],"attributed_bytes":0,"content_bytes":0,"eligible_bytes":0,"unattributed":[],"unattributed_bytes":0,"unattributed_content":[],"unattributed_content_bytes":0},"policy_hash":"sha256:5ccce59c54d46f4c0ca75a466edc72f9aa146584cef7b3920014e91bd57d5f53","qualification_identity_ref":"sha256:6ad6a02c2e9e16e53cfe5cda3786142e58a632a1fc35875334a188721e3bb146","recognized":[{"end":6,"start":0},{"end":22,"start":21}],"recognized_bytes":7,"regions":{"body":{"end":22,"start":0},"header":{"end":0,"start":0},"tail":{"end":22,"start":22}},"schema_version":"abc/parser-rq-source-recognition-work/v3","semantic_gap_bytes":15,"semantic_gaps":[{"end":21,"start":6}],"status":"ok","unaccounted":[],"unaccounted_bytes":0,"work_id":"sha256:1486e2c65f6f346b55367050911703554bd5134827c9a8ffba24717be61d5239"}