{"accounted":[{"end":10,"start":0}],"accounted_bytes":10,"capture_generation_ref":"sha256:ee669e6566ad8b8ecbb9e427ad486d1fcbd76ad4286670fbff18ff6453494bdb","coordinate_system":"decoded_utf8","eligible_bytes":10,"instrument_version":"parser-rq-source-recognition-v4","ledger":{"bytes":1795,"locator":"sha256/31/31574410799963f72ce43dc544d846a202cbf9155f47199b31bab1b8344963fd.json","media_type":"application/json","sha256":"sha256:31574410799963f72ce43dc544d846a202cbf9155f47199b31bab1b8344963fd"},"metadata":{"attributed":[],"attributed_bytes":0,"content_bytes":0,"eligible_bytes":0,"unattributed":[],"unattributed_bytes":0,"unattributed_content":[],"unattributed_content_bytes":0},"policy_hash":"sha256:5ccce59c54d46f4c0ca75a466edc72f9aa146584cef7b3920014e91bd57d5f53","qualification_identity_ref":"sha256:db804ae6162a6dea2b71e04d465c4e8d0ade0ccf5fbf798d4d670b84c9c7ab78","recognized":[{"end":10,"start":6}],"recognized_bytes":4,"regions":{"body":{"end":10,"start":0},"header":{"end":0,"start":0},"tail":{"end":10,"start":10}},"schema_version":"abc/parser-rq-source-recognition-work/v3","semantic_gap_bytes":6,"semantic_gaps":[{"end":6,"start":0}],"status":"ok","unaccounted":[],"unaccounted_bytes":0,"work_id":"sha256:5276852ac6edac7641fae7492d55ef6d5c6be3e51a8adb288992d969934d5de2"}