{"accounted":[{"end":22,"start":0}],"accounted_bytes":22,"capture_generation_ref":"sha256:c15b480be4ef5fb6f44906a1460c8a7ca626afdcf555f22e5bf1eb56fa495dcf","coordinate_system":"decoded_utf8","eligible_bytes":22,"instrument_version":"parser-rq-source-recognition-v4","ledger":{"bytes":2091,"locator":"sha256/d2/d2af933fe120df931739baf6dd514c03339248726397fac5d3c65d4839419187.json","media_type":"application/json","sha256":"sha256:d2af933fe120df931739baf6dd514c03339248726397fac5d3c65d4839419187"},"metadata":{"attributed":[],"attributed_bytes":0,"content_bytes":0,"eligible_bytes":0,"unattributed":[],"unattributed_bytes":0,"unattributed_content":[],"unattributed_content_bytes":0},"policy_hash":"sha256:5ccce59c54d46f4c0ca75a466edc72f9aa146584cef7b3920014e91bd57d5f53","qualification_identity_ref":"sha256:db804ae6162a6dea2b71e04d465c4e8d0ade0ccf5fbf798d4d670b84c9c7ab78","recognized":[{"end":6,"start":0},{"end":22,"start":21}],"recognized_bytes":7,"regions":{"body":{"end":22,"start":0},"header":{"end":0,"start":0},"tail":{"end":22,"start":22}},"schema_version":"abc/parser-rq-source-recognition-work/v3","semantic_gap_bytes":15,"semantic_gaps":[{"end":21,"start":6}],"status":"ok","unaccounted":[],"unaccounted_bytes":0,"work_id":"sha256:1486e2c65f6f346b55367050911703554bd5134827c9a8ffba24717be61d5239"}