{"accounted":[{"end":18,"start":0}],"accounted_bytes":18,"capture_generation_ref":"sha256:8d85f64a7260ccbbf5269a6dc3a92eabd828090563f02b118b4e5a335820c675","coordinate_system":"decoded_utf8","eligible_bytes":18,"instrument_version":"parser-rq-source-recognition-v4","ledger":{"bytes":1795,"locator":"sha256/f6/f6f1b553cfccbba489ba188984d8ff9478481506f604a3683d0c81ceb34ca3e4.json","media_type":"application/json","sha256":"sha256:f6f1b553cfccbba489ba188984d8ff9478481506f604a3683d0c81ceb34ca3e4"},"metadata":{"attributed":[],"attributed_bytes":0,"content_bytes":0,"eligible_bytes":0,"unattributed":[],"unattributed_bytes":0,"unattributed_content":[],"unattributed_content_bytes":0},"policy_hash":"sha256:5ccce59c54d46f4c0ca75a466edc72f9aa146584cef7b3920014e91bd57d5f53","qualification_identity_ref":"sha256:6ad6a02c2e9e16e53cfe5cda3786142e58a632a1fc35875334a188721e3bb146","recognized":[{"end":18,"start":6}],"recognized_bytes":12,"regions":{"body":{"end":18,"start":0},"header":{"end":0,"start":0},"tail":{"end":18,"start":18}},"schema_version":"abc/parser-rq-source-recognition-work/v3","semantic_gap_bytes":6,"semantic_gaps":[{"end":6,"start":0}],"status":"ok","unaccounted":[],"unaccounted_bytes":0,"work_id":"sha256:301f9791d9dc70e40ed954376996776f019d8bf447a4c328e980c2de1f9f94b9"}