{"accounted":[{"end":7,"start":0}],"accounted_bytes":7,"capture_generation_ref":"sha256:fa03c6b6069b09a7698b65e32b6c7d31989b104c2332749b89a4c93a7cb96e10","coordinate_system":"decoded_utf8","eligible_bytes":7,"instrument_version":"parser-rq-source-recognition-v4","ledger":{"bytes":1757,"locator":"sha256/ca/cafc9223b1e347e030dab1778cbdb373dc340c840edc667cc5dab227b7a10321.json","media_type":"application/json","sha256":"sha256:cafc9223b1e347e030dab1778cbdb373dc340c840edc667cc5dab227b7a10321"},"metadata":{"attributed":[],"attributed_bytes":0,"content_bytes":0,"eligible_bytes":0,"unattributed":[],"unattributed_bytes":0,"unattributed_content":[],"unattributed_content_bytes":0},"policy_hash":"sha256:5ccce59c54d46f4c0ca75a466edc72f9aa146584cef7b3920014e91bd57d5f53","qualification_identity_ref":"sha256:6ad6a02c2e9e16e53cfe5cda3786142e58a632a1fc35875334a188721e3bb146","recognized":[{"end":7,"start":0}],"recognized_bytes":7,"regions":{"body":{"end":7,"start":0},"header":{"end":0,"start":0},"tail":{"end":7,"start":7}},"schema_version":"abc/parser-rq-source-recognition-work/v3","semantic_gap_bytes":0,"semantic_gaps":[],"status":"ok","unaccounted":[],"unaccounted_bytes":0,"work_id":"sha256:6b2676d80da84264c9c704f58ab4ba961651f6e4de14d639e54431c44fd5da8e"}