{"accounted":[{"end":10,"start":0}],"accounted_bytes":10,"capture_generation_ref":"sha256:3b71bb601ff35bf06af18de17a8964566267fdcd8d369c515c996a4894fe4a24","coordinate_system":"decoded_utf8","eligible_bytes":10,"instrument_version":"parser-rq-source-recognition-v4","ledger":{"bytes":1381,"locator":"sha256/9b/9bc63849c29708442fc8cb8c12c7440b52e7798ec986a46552b6f7d76921e472.json","media_type":"application/json","sha256":"sha256:9bc63849c29708442fc8cb8c12c7440b52e7798ec986a46552b6f7d76921e472"},"metadata":{"attributed":[],"attributed_bytes":0,"content_bytes":0,"eligible_bytes":0,"unattributed":[],"unattributed_bytes":0,"unattributed_content":[],"unattributed_content_bytes":0},"policy_hash":"sha256:5ccce59c54d46f4c0ca75a466edc72f9aa146584cef7b3920014e91bd57d5f53","qualification_identity_ref":"sha256:6ad6a02c2e9e16e53cfe5cda3786142e58a632a1fc35875334a188721e3bb146","recognized":[],"recognized_bytes":0,"regions":{"body":{"end":10,"start":0},"header":{"end":0,"start":0},"tail":{"end":10,"start":10}},"schema_version":"abc/parser-rq-source-recognition-work/v3","semantic_gap_bytes":10,"semantic_gaps":[{"end":10,"start":0}],"status":"ok","unaccounted":[],"unaccounted_bytes":0,"work_id":"sha256:5276852ac6edac7641fae7492d55ef6d5c6be3e51a8adb288992d969934d5de2"}