{"accounted":[{"end":10,"start":0}],"accounted_bytes":10,"capture_generation_ref":"sha256:52fb331120eb75d0a0dd8b03314eabcd7169d8cce83ac1bcbc604d07b941ea42","coordinate_system":"decoded_utf8","eligible_bytes":10,"instrument_version":"parser-rq-source-recognition-v3","ledger":{"bytes":1795,"locator":"sha256/18/18521a3824e2304011912fb5f7fdf36c64994d726e8be868c6876e92375b8efd.json","media_type":"application/json","sha256":"sha256:18521a3824e2304011912fb5f7fdf36c64994d726e8be868c6876e92375b8efd"},"metadata":{"attributed":[],"attributed_bytes":0,"content_bytes":0,"eligible_bytes":0,"unattributed":[],"unattributed_bytes":0,"unattributed_content":[],"unattributed_content_bytes":0},"policy_hash":"sha256:42949d485493331f1c20dcd1098477c4a314dd9837057fc094688095e1850bee","qualification_identity_ref":"sha256:0bf4a1ca93935ca224b9517053b9e1667bb9d99d970bce1b53e29ecf022b7d95","recognized":[{"end":10,"start":6}],"recognized_bytes":4,"regions":{"body":{"end":10,"start":0},"header":{"end":0,"start":0},"tail":{"end":10,"start":10}},"schema_version":"abc/parser-rq-source-recognition-work/v3","semantic_gap_bytes":6,"semantic_gaps":[{"end":6,"start":0}],"status":"ok","unaccounted":[],"unaccounted_bytes":0,"work_id":"sha256:5276852ac6edac7641fae7492d55ef6d5c6be3e51a8adb288992d969934d5de2"}