{"accounted":[{"end":10,"start":0}],"accounted_bytes":10,"capture_generation_ref":"sha256:1a583d9ccf4a96a90d1f6abe6608cc97edbc3235d3723be5fd8bc911d1579421","coordinate_system":"decoded_utf8","eligible_bytes":10,"instrument_version":"parser-rq-source-recognition-v4","ledger":{"bytes":1795,"locator":"sha256/e9/e928df1611eaa1c5a8fcd8d12638777991dd07c826af74a16a29078ae4fadf07.json","media_type":"application/json","sha256":"sha256:e928df1611eaa1c5a8fcd8d12638777991dd07c826af74a16a29078ae4fadf07"},"metadata":{"attributed":[],"attributed_bytes":0,"content_bytes":0,"eligible_bytes":0,"unattributed":[],"unattributed_bytes":0,"unattributed_content":[],"unattributed_content_bytes":0},"policy_hash":"sha256:42949d485493331f1c20dcd1098477c4a314dd9837057fc094688095e1850bee","qualification_identity_ref":"sha256:db804ae6162a6dea2b71e04d465c4e8d0ade0ccf5fbf798d4d670b84c9c7ab78","recognized":[{"end":10,"start":6}],"recognized_bytes":4,"regions":{"body":{"end":10,"start":0},"header":{"end":0,"start":0},"tail":{"end":10,"start":10}},"schema_version":"abc/parser-rq-source-recognition-work/v3","semantic_gap_bytes":6,"semantic_gaps":[{"end":6,"start":0}],"status":"ok","unaccounted":[],"unaccounted_bytes":0,"work_id":"sha256:5276852ac6edac7641fae7492d55ef6d5c6be3e51a8adb288992d969934d5de2"}